{
  "type": "onap.policies.controlloop.Operational",
  "type_version": "1.0.0",
  "properties": {
    "content": "controlLoop%3A%0A%20%20version%3A%202.0.0%0A%20%20controlLoopName%3A%20ControlLoop-vDNS-6f37f56d-a87d-4b85-b6a9-cc953cf779b3%0A%20%20services%3A%0A%20%20%20%20-%20serviceName%3A%20d4738992-6497-4dca-9db9%0A%20%20%20%20%20%20serviceInvariantUUID%3A%20dc112d6e-7e73-4777-9c6f-1a7fb5fd1b6f%0A%20%20%20%20%20%20serviceUUID%3A%202eea06c6-e1d3-4c3a-b9c4-478c506eeedf%0A%20%20trigger_policy%3A%20unique-policy-id-1-scale-up%0A%20%20timeout%3A%2060%0A%0Apolicies%3A%0A%20%20-%20id%3A%20unique-policy-id-1-scale-up%0A%20%20%20%20name%3A%20Create%20a%20new%20VF%20Module%0A%20%20%20%20description%3A%0A%20%20%20%20actor%3A%20SO%0A%20%20%20%20recipe%3A%20VF%20Module%20Create%0A%20%20%20%20target%3A%0A%20%20%20%20%20%20type%3A%20VFMODULE%0A%20%20%20%20%20%20modelInvariantId%3A%20e6130d03-56f1-4b0a-9a1d-e1b2ebc30e0e%0A%20%20%20%20%20%20modelVersionId%3A%2094b18b1d-cc91-4f43-911a-e6348665f292%0A%20%20%20%20%20%20modelName%3A%20VfwclVfwsnkBbefb8ce2bde..base_vfw..module-0%0A%20%20%20%20%20%20modelVersion%3A%201%0A%20%20%20%20%20%20modelCustomizationId%3A%2047958575-138f-452a-8c8d-d89b595f8164%0A%20%20%20%20payload%3A%0A%20%20%20%20%20%20requestParameters%3A%20%27%7B%22usePreload%22%3Atrue%2C%22userParams%22%3A%5B%5D%7D%27%0A%20%20%20%20%20%20configurationParameters%3A%20%27%5B%7B%22ip-addr%22%3A%22%24.vf-module-topology.vf-module-parameters.param%5B9%5D%22%2C%22oam-ip-addr%22%3A%22%24.vf-module-topology.vf-module-parameters.param%5B16%5D%22%2C%22enabled%22%3A%22%24.vf-module-topology.vf-module-parameters.param%5B23%5D%22%7D%5D%27%0A%20%20%20%20retry%3A%200%0A%20%20%20%20timeout%3A%2030%0A%20%20%20%20success%3A%20final_success%0A%20%20%20%20failure%3A%20final_failure%0A%20%20%20%20failure_timeout%3A%20final_failure_timeout%0A%20%20%20%20failure_retries%3A%20final_failure_retries%0A%20%20%20%20failure_exception%3A%20final_failure_exception%0A%20%20%20%20failure_guard%3A%20final_failure_guard%0A"
  },
  "name": "vdns",
  "version": "1.0.0"
}
