{
    "type": "onap.policies.controlloop.Operational",
    "type_version": "1.0.0",
    "properties": {
        "policy-id": "operational.pcihandler",
        "content": "controlLoop%3A%0A%20%20version%3A%203.0.0%0A%20%20controlLoopName%3A%20ControlLoop-vPCI-fb41f388-a5f2-11e8-98d0-529269fb1459%0A%20%20trigger_policy%3A%20unique-policy-id-123-modifyconfig%0A%20%20timeout%3A%201200%0A%20%20abatement%3A%20false%0A%20%0Apolicies%3A%0A%20%20-%20id%3A%20unique-policy-id-123-modifyconfig%0A%20%20%20%20name%3A%20modify%20PCI%20config%0A%20%20%20%20description%3A%0A%20%20%20%20actor%3A%20SDNR%0A%20%20%20%20recipe%3A%20ModifyConfig%0A%20%20%20%20target%3A%0A%20%20%20%20%20%20%23%20These%20fields%20are%20not%20used%0A%20%20%20%20%20%20resourceID%3A%20Eace933104d443b496b8.nodes.heat.vpg%0A%20%20%20%20%20%20type%3A%20VNF%0A%20%20%20%20retry%3A%200%0A%20%20%20%20timeout%3A%207000%0A%20%20%20%20success%3A%20final_success%0A%20%20%20%20failure%3A%20final_failure%0A%20%20%20%20failure_timeout%3A%20final_failure_timeout%0A%20%20%20%20failure_retries%3A%20final_failure_retries%0A%20%20%20%20failure_exception%3A%20final_failure_exception%0A%20%20%20%20failure_guard%3A%20final_failure_guard"
    },
    "name": "vpci",
    "version": "1.0.0"

}
