{
  "type": "onap.policies.controlloop.Operational",
  "type_version": "1.0.0",
  "properties": {
    "content": "controlLoop%3A%0A%20%20version%3A%202.0.0%0A%20%20controlLoopName%3A%20ControlLoop-vFirewall-d0a1dfc6-94f5-4fd4-a5b5-4630b438850a%0A%20%20services%3A%0A%20%20%20%20-%20serviceInvariantUUID%3A%20f6937c86-584c-47ae-ad29-8d41d6f0cc7c%0A%20%20%20%20%20%20serviceUUID%3A%207be584e2-0bb2-4126-adaf-ced2c77ca0b3%0A%20%20%20%20%20%20serviceName%3A%20Service_Ete_Name7ba1fbde-6187-464a-a62d-d9dd25bdf4e8%0A%20%20trigger_policy%3A%20unique-policy-id-1-modifyConfig%0A%20%20timeout%3A%2060%0A%20%20abatement%3A%20false%0A%20%0Apolicies%3A%0A%20%20-%20id%3A%20unique-policy-id-1-modifyConfig%0A%20%20%20%20name%3A%20modify%20packet%20gen%20config%0A%20%20%20%20description%3A%0A%20%20%20%20actor%3A%20APPC%0A%20%20%20%20recipe%3A%20ModifyConfig%0A%20%20%20%20target%3A%0A%20%20%20%20%20%20resourceID%3A%20bbb3cefd-01c8-413c-9bdd-2b92f9ca3d38%0A%20%20%20%20%20%20type%3A%20VNF%0A%20%20%20%20retry%3A%200%0A%20%20%20%20timeout%3A%207%0A%20%20%20%20success%3A%20final_success%0A%20%20%20%20failure%3A%20final_failure%0A%20%20%20%20failure_timeout%3A%20final_failure_timeout%0A%20%20%20%20failure_retries%3A%20final_failure_retries%0A%20%20%20%20failure_exception%3A%20final_failure_exception%0A%20%20%20%20failure_guard%3A%20final_failure_guard"
  },
  "name": "vfw",
  "version": "1.0.0"
}
